Word,Description
Hriek (n),oil
Hriek nal (v),to anoint
Hriel (v),to cut bit bit bit to make a shape
Hriemchawi (v),to be armed
Hriemhrei (n),"weapon, arms"
Hriemhrie (n),a sexual pervert
Hriengzau (n),a species of birch
Hriepuitu (n),witness
Hriet (v),"to hear, to feel, to understand, to know, to surmise, to remember"
Hrietfiena (n),a proof
Hrietfuk (adj),"to remember, to bear in mind"
Hrietkir (v),to recollect
Hrietlawk (v),"to foresee, to foreknow"
Hrietna (n),knowledge
Hrietna var (n),science
Hrietpui (v),to be a witness
Hrietsuok (v),to know well
Hrietsuok nawk (adv),to recollect
Hrietthawi (v),to know vaguely
Hrietthiem (v),"to understand, to comprehend"
Hrietthiem lo (v),"to misunderstand, to not understand"
Hriettir (v),"to explain, to cause to know, to show how to do"
Hrietu (n),one who knows
Hrietzing (v),"remember, to keep in mind"
Hrik (n),"a louse, parasitical insects"
Hrikthra (n),a body louse
Hril loa hmang (phrase),one who is great and whose greatness need no further mention
Hril ruol lo (adj),"unspeakable, impossible to express"
Hrila trangkai lo (v),worthless to speak
Hrileng (v),outbreak of epidemic or disease
Hrilfie (v),to explain
Hrilfiebu (n),a commentary book
Hrilfiena (v),that which explains
Hrilfietu (n),a commentator
Hrilhai (v),"to be baffled, not know what to do, say or think"
Hrilhai thlak (v),to be lost with words
Hrilhmu (v),"to advise, to give hint"
Hrilhnuol (v),"to belittle, to speak against"
Hrilhriet (v),to make someone understand
Hrilin (v),"by telling, by speaking"
Hrilin a siek nawh (v),to be beyond human words to express
Hrilkhi (v),compare
Hrillang (v),"to speak out, to make known, to speak openly"
Hrillawk (v),"to foretell, to prophesy, to say beforehand"
Hrillawkna (n),"prediction, prophesy"
Hrilmawi (v),"to praise, to recommend"
Hrilmawina (n),"recommendation, word of praise"
Hrilnon (v),"to repeat, to iterate"
Hrilpui (v),"to speak for, to plead for"
Hrilpuitu (n),"an advocate, one who pleads for"
Hrilsie (v),to say speak evil of
Hrilsuok (v),"announce, to disclose, to reveal"
Hrilsuol (n),"to make a mistake while speaking, to say a thing by mistake"
Hrilthawi (v),"to hint, to speak vaguely"
Hriltri (v),"to frighten, to scare"
Hriltu (n),one who speak
Hriluor (v),"to exaggerate, to stress"
Hriluorna (n),exaggeration
Hrim (adv),"as it is, so it is, it is"
Hrim hrim (adv),of all type and kind
Hring (adj),"alive, to live"
Hring (v),"to bear, to beget, to bring forth"
Hring (adv),"green (colour), fresh, green (not withered)"
Hring fa (n),a cannibal
Hringhlum (v),"still-born, to give birth to a dead offspring"
Hringlang tlang (n),"the mount believed to be crossed by the spirits of the dead and on which the land of the living can be seen (the spirits of the dead pluck and wear flowers in their hair or ears, and after that have no desire to turn and look back towards the earth they have left)"
Hringmi (n),poetical term for human being
Hringnun (n),life
Hripui (n),"an epidemic, a pestilence, plague"
Hrisel (adj),"healthy, free from sickness"
Hriselna (n),"health, hygiene"
Hritlang (v),"to have a cold, to be unwell"
Hritlang khawsik (n),influenza
Hrivoi (v),to get or contract any disease
Hrizawl (n),"an open or empty space where large people can gather, a large mat or a threshing floor where paddy are manually crashed"
Hro (v),dry
Hrohrang (adj),aggressive nature
Hrol (adj),"huge, gigantic, big"
Hromhraw (adj),"large and well built, robust in work and food habit"
Hron (adj),"in unity, together"
Hrot (v),hardening
Hru (v),"wipe, mop"
Hrui (n),"a creeper, cane, rope, string"
Hruichun (n),name of creeper
Hruiduk (n),the name of a creeper with a bean-like fruit
Hruihruol (n),"string, rope"
Hruipawl (n),the name of a creeper
Hruipuithei (n),the name of a creeper with edible fruit
Hruisen (n),the name of a climbing plant
Hruizam (n),"a creeper, a climbing plant"
Hruk hul (v),to rub or wipe dry
Hrukfai (v),"to scour, to rub clean, to wipe (using cloth, etc)"
Hrukfaina (n),"a duster, wiper, mopper"
Hrulah (adv),"close by, along side"
Hrumhriel (adj),"as it is, without polishing"
Hruoi (n),the part of a four-legged animal meat usually reserved for a Hmar man’s ‘sasem’
Hruol (v),"to roll up in the hand, to twist"
Hruol (n),a rope
Hruolmum (v),to roll up in the hand to be made round in shape
Hrût (adj),inadequately ripen fruit due to deformity or malformation
Hrùt (v),"to thresh, to rub, to wears, to move along"
Hrùtnam (v),"to thresh and level off, to level the surface, to roll over and smoothen"
Hrutruolna (n),a roller
Hu (adj),"wet, to be wet, to get wet"
Hu (v),"to be equivalent, to be equal to"
Hu (n),"vapour, steam"
Huho (n),"in a company, in a band, a party, a group"
Hui (n),"the whistle of the mouth when Hmars made when carrying heavy loads, etc"
Hûiêm (n),name of a species of ‘vahui’ bird
Huihah! (intjn),to make a grunting noise when carrying a load
Hûimeisei (n),name of a species of ‘vahui’ bird
Huiphai (n),a person who is not normal or below average
Huit (n),wheat
Hûitupui (n),name of a species of ‘vahui’ bird
Hul (adj),dry
Hulhliep (n),"a verandah, the front gable of a house"
Hulhû (n),an edible wild creeper plant
Hulhuol (adv),"under no circumstances, on no condition, not at all (a thei naw hulhuol = not possible at all)"
Hum (v),"protect, defend, guard, shield, etc"
Hùm (v),"to clench (the hand), to clasp, to grasp"
Humhal (v),"to reserve for oneself, preserve"
Humhim (v),"to protect, defend, guard, shield, etc"
Humhimna (n),"that which protect, defend, guard, shield, etc"
Humhimtu (n),"one who protect, defend, guard, shield, etc"
Hun (n),"time, season, when (in the future)"
Hun (adj),enough
Hun bi tuk (v),"to fix a certain time, to fix a particular time"
Hun hmang (v),"to spend time, to occupy time"
Hun khawral (v),"to waste time, to spend time uselessly"
Hun laiin (adv),at the time of
Hun raw se (phrase),let it be enough
Hun raw se (adv),let it be enough
Hun remchang (n),"convenient time, an opportune time"
Hun sawn (v),"to alter the time, to postpone"
Hun tawk chie (adv),"to be exactly enough, to be ample"
Hun tawp (n),the end time
Hunbi (n),"a fixed time, period, season, hour, etc"
Hunbi nei (v),"to have a regular, fixed or appointed time, period or season"
Hung (v),come
Hunser (n),solemn period or occasion
Huntawk (adj),"enough, sufficiently, to be enough, to be sufficient"
Huntawk (adj),"enough, just enough, exactly enough"
Huoi (adj),"bold, brave, valiant, daring, heroic, fearless"
Huoi (n),"a demon, an evil spirit"
Huoilut (v),to drag in
Huoina (n),"bravery, boldness"
Huoiruoi (n),name of a variety of mustard
Huoirût (n),the sudden burst of mud and water in streams and small rivers
Huoisen (adj),"brave, daring, courageous"
Huoisenna (n),"boldness, bravery"
Huoisuol (v),to become septic or get poisoned
Huoitakin (adv),"bravely, boldly, courageously"
Huoithupui (n),name of a variety of wild bird
Huol (v),"to surround, to besiege; reserve, to reserve, to engage"
Huol lungril (v),to make a mental note of privately without letting others know
Huolhang (n),a sub clan of Hmar Lusei clan
Huolngo (n),a sub clan of Hmar Lusei clan
Huolvel (v),"to encircle, to surround"
Huom (v),"to dare, to be prepared (to do anything); to include, to take in"
Huom (n),bubble
Huomhap (adj),"greedy, avaricious, rapacious, voracious, grasping"
Huomsa (v),to include
Huon (n),"a garden, a yard"
Huondai (n),fence
Huong (n),"an enclosure, a yard, enclosure, pen, fold"
Huongsung (n),"a yard, enclosure, pen, fold"
Huongtau (adj),in the habit of being exceeding than usual
Huonkang (n),a cooking style of meat
Huop (v),to include
Huopzau (adj),"encompassing, accommodating"
Huor (v),to give extra attention to someone with some expectation from the other end
Huot (v),"to scratch up, to unearth by scratching"
Huot ruol (v),"to scrape level (with hand, hoe, etc)"
Huou huou (n),"social intercourse and other enjoyment, etc"
Huou huou (adv),"flowing out (liquid, water) in large volume"
Hup (v),"to cover (with the hand, etc.) to sip, to suck up, to draw in (as breath)"
Huphlum (v),to suffocate by stopping the nose and mouth
Hur (adj),"to be on heat, to have sexual desire"
Husawp (n),hyssop
Hût (n),"blighted, worms, disease"
Hût pai (v),"to have worms, disease"
I (prn),"you, your, yours"
I ta (prn),"yours, thine"
Idaw (n),a species of rice
Iei (v),not satisfy
Iem (prn),what (interrogative)
Iem a ti a (prn with interrogation mark),why?
Iem ie (prn with interrogation mark),what?
Iemani (n),use to denote ‘something’
Iemani bek (n),at least something
Iemani zat (adv),"a certain amount, a certain quantity"
Iemati khom (prn),"no reason, nothing"
Iemati lie (prn with interrogation mark),why is it?
Ieng dang khom (adv),"nothing more, nothing else"
Ieng ding am (adv),for what?
Ieng inkhawk am? (phrase),why?
Ieng le ang (adj),to behave with pride
Ieng le khawleh (prn),whatever
Ieng lei am? (phrase),why?
Ieng lem am (prn with interrogation mark),which one?
Ieng tik am (phrase),when?
Ieng tik lai khom (adv),"at all time, anytime"
Ieng tin am (adv with interrogation mark),how?
Iengdim (adv with interrogation mark),for what?
Iengkhom (n),nothing
Iengkhom nisien (adv),whatever be the case
Iengkhom ti lo (adv),"uninjured, unharmed, not damaged"
Iengkhomlo (n),nothing
Iengkim (n),"everything, all kind of, all things"
Ienglaikhom (adv),not at any time
Iengma lo (adv),"of no account, for nothing"
Iengmalo (n),"nothing, worthless"
Iengtin khom (adv),"by no means, not by any means"
Ihe (v),"to gainsay, to grumble, to make a fuss"
Ihe lovin (adv),without much ado or grumble or hesitation
Ikaithabi (n),an edible water plant of the ‘touch me not’ family found in abundance in Manipur valley
Ikthik (adj),"to envy, to be jealous of"
Ikthik um (adj),enviable
Ikthikna (n),jealousy
Imu (n),sleep
Imu du (v),to be habitually sleepy
Imu he (n),"heavy sleeper, one who usually sleep long"
Imu hmu (v),to sleep peacefully
Imu hmu lo (v),to not get enough sleep
Imu inden (n),sleeping peacefully
Imu inhnik (n),a sound sleep
Imu suok (v),"wanting to sleep, to feel sleepy"
Imu suok (adj),sleepy
In (v),"sleep, sleeping"
In (n),"a house, a home, a shelter"
In (prefix),an affix indicating the nominative case when the subject is followed by a transitive verb
In (prefix),"a reflexive pronominal prefix, himself, herself, themselves, etc (keiin/ke’n – by me; nangin = by you)"
In (prefix),"a prefix denoting reciprocity, with one another, one another, each other, etc"
In at (v),"to cut, a surgical operation"
In chung (n),the roof of a house
In fe tir (v),"to send away, to let go"
In hlum (v),"sudden death, to die while sleeping"
In hna (n),a variety of thorny leaf used as roof in a traditional Hmar village hut
In hnok (n),the name of a game played by boys with ‘pawi’
In khilai (v),to treat someone free of cost (with eatables or things)
In la (adverbial suffix),if we
In le lo (n),land and houses
In leng (n),one’s house visitor
In lum (n),one’s own warm house
In mû le âr (phrase),in enmity like an eagle and a fowl
In rap thliek (n),census (general census enumerators of pre and post early independent India being semi-illiterate pluck a piece of split bamboo of the front walls of each house they visit. They bind together those little bamboo sticks and took to their headquarters where the number of houses is determined from the number of sticks. The number of members in the house seems to be roughly further calculated from the houses)
In san (v),to go to sleep while others still lie awake
In sawng (n),"a house with storey, the storied house"
In ta (prn),yours (plural)
In tehlem (v),to pretend to sleep
In tin (adv),"from house to house, every house"
In ‘Di (n),"to be in a romantic relationship, to be in love with each other (a man and a woman)"
Inai (n),"the ember of fire, the sparkling red hot (wood, iron, etc)"
Inaihal (adj),"incompatible, incapable of combination (as different drugs, etc), to disagree with one another"
Inang (adj),"alike, similar, identical, resembling, equal"
Inang lo (adj),"unlike, dissimilar, different"
Inang lona (n),"difference, dissimilarity"
Inangna (n),"similarity, resemblance"
Inawi (v),"slow, not in hurry, time consuming"
Inawi (v),to hush a child
Inawk (v),to get entangle
Inawkhlum (v),to hang oneself to death
Inawl (v),to free (someone)
Inawn (adj),"slanting, inclined"
Inawt (n),a tree that is about to fall (after it is cut)
Inba (v),"make to eat (mother to a child), to put or stuff (food) into each other’s mouth"
Inbâi (v),"to limp, to walk lamely"
Inban (v),"moving using the hand, to reach out the hand to another"
Inbân (v),"resign, to resign, resignation"
Inbarlui (v),"to force feed, force feeding"
Inbattir (v),giving someone something on credit
Inbâttir (v),placing (cloth) to someone’s shoulder
Inbâttuo (v),"to be linked together, to be hooked together"
Inbauh (v),bark (of dog)
Inbauphak (adj),to be near to each other
Inbaw (n),wrestling
Inbawk (adj),"a swelling, to come into a bump, an excrescence"
Inbawr (adj),"bunch, bunching"
Inbe (v),the cry (sound) of lamb and kid
Inbei (v),"leaning on someone’s (shoulder, chest)"
Inbeina (n),"a fight, a combat, a conflict, battle"
Inbel (v),"wear, to wear"
Inbelbawm (v),"to be stuck, bound, joined, or tied together"
Inbèm (adj),plump or chubby in looks or appearance
Inbengbel (v),to settle oneself
Inbi (v),"hide, to hide"
Inbie (v),"to talk, to have a talk, to converse with one another"
Inbiekna (n),"a conversation, an intercourse, a talk, a dialogue"
Inbiekrawn (v),"to take counsel, to consult each other"
Inbiekruk (v),to whisper or speak to each other in a hush tone
Inbiel (adj),"of spherical in shape, round shape"
Inbihmang (v),to hide away oneself
Inbikruk (v),"hide, hiding"
Inbikruk siek (n),the children’s game of ‘hide and seek’
Inbingbilet (v),to somersault
Inbitum (v),"to single out each other and oppose one another, to stand up to one another (in game, battle, etc)"
Inbuk (adj),"bushy, unkempt, hairy"
Inbûk (v),to measure one’s weight
Inbukna (n),a weighing scale
Inbûm (v),to be together in one spot
Inbuo (v),spill out (liquid substance or powdery items)
Inbuol (v),to play or while away in muddy water (like a buffalo)
Inbuon (n),a Hmar Lungtau sub clan
Inbuon (n),"wrestle, wrestling"
Inbuotsai (v),"to prepare, to make preparation"
Inbuotsaina (n),preparation
Inbûr (v),"to pierce through and be visible (arrow); to be fully engaged in one’s assignment or job, to mind one’s own business"
Inbuvawr (n),children’s play with pebbles or pieces of stone
Incha (v),to ask something from a distance
Inchaih (v),to romp or play together
Inchalrem (v),"to agree with each other, to make accord"
Inchan (v),to put oneself in another’s place
Inchàn (v),"to discretely wait for something (such as animal or enemy, etc)"
Inchang (v),"change into, to become"
Inchapchar (v),to openly engage with each other (verbal)
Inchat (v),"broken (like a thread, rope, etc)"
Inchaw (v),"buy, to buy"
Inchawi (v),to bet with money or other items
Inchawk (v),"to buy, to barter"
Inchawm (v),"to leap, to jump, to gallop, to canter"
Inchawm thla (v),to jump down from height
Inchei (v),"to make one's self tidy, to adorn one's self, to be tidy"
Incheina (n),"dress, ornaments"
Inchek (v),"scoff because of wounds, appalled, horrified, scorn and cursing"
Inchek (v),"scattered, untidy, in a complete mess"
Inchêk (v),"lavish spending, reckless and uncontrolled wasting of one’s resources"
Inchel (v),to hold each other
Inchemhar lak (v),to single out individually against each other
Indam (v),to properly give birth and brought up a child
Indang (v),to move to a separate house
Indap (v),"to examine oneself, to search oneself or search one another"
Indap (adj),"partly wet, not dry"
Indar (adj),"to be dispersed, to be scattered, to be scattered abroad, etc"
Indawi (v),to fight with each other in witchcraft or magic
Indawn (v),making someone to sip or drink (liquid)
Indawp (v),to interrogate someone to get the truth
Indawr (v),"to buy and sell, to barter, to bargain"
Indawt (v),to impale oneself using sharp and pointed materials
Indei (adj),"adequate, enough, sufficient"
Indeizai (adj),useful or serviceable in a variety of ways or one who is available for such ways
Indem (v),to speak ill and criticise each other
Indên (adj),doing or being in a state of calm and peace (esp sleeping or sitting)
Inder (v),to sprout out
Indik (adj),"correct, true, right"
Indikna (n),"truth, righteousness, justice"
Indin (v),to establish
Indîp (v),to be in one another's way
Indit (v),to like or love each other
Indo (v),to be at enmity or war with one another
Indoi (v),"to take care carefully, to be gentle with"
Indoi takin (adv),"gently, carefully, temperately"
Indok (v),"to sprout, to shoot"
Indomkun (v),to hold the head low with worry
Indomtuo (v),"to held up each other, to help each other"
Indon (v),"to ask a question, to make a query"
Indona (n),"a battle, a war"
Indona hmangruo (n),"armament, armour, weapon"
Indona long (n),a warship
Indopui (n),"world war, a big war, to be at war with somebody"
Indotin (adv),"one after the other, in consecutive order, next to each other"
Indu (v),"to be proud of oneself, to be proud"
Induong (v),to arrange
Induthaw (adj),"to be mindful of one’s job, to be wholehearted in one’s assignment"
Inei (n),a celebration performed after killing fierce wild animals
Inek (adj),"torn (shirt, etc)"
Inel (v),"to squabble, to strive together to excel or rival one another, to emulate one another, to vie with one another; sprain"
Inelna (n),competition
Inen (v),watching oneself in the mirror
Inenfie (v),to examine oneself
Inentir (v),"to show something to others, to have oneself examine by a doctor"
Inep (adj),"to be opposite each other, to be in array one against the other"
Iner (adj),to be jealous of each other
Infaktir (v),"to feed, to give something to eat, to make someone eat"
Infân (adj),"stretch, elastic"
Infar (v),"to let it fall in drop, drop by drop"
Infawkkhawm (v),"to gather together, to come together"
Infawn (v),"wave of the sea, water, etc"
Infawp (v),kissing each other
Infiel (v),to invite one another
Infiem (v),"to play, to play a game, to play a sport"
Infiemna (n),"a play, a joke, a game, a sport"
Infimate (n),a Hmar Lungtau sub clan
Infin (v),"to merge into one, to join together, to run into one another (as rivers), to gather together"
Infor (v),to roam or loiter freely
Infûi (v),"to encourage, egg on someone"
Infuina (n),"encouragement, advice"
Infuipor (v),"to stir up, to inflame, to instigate"
Infuol (adj),"loose or long downwards (coat, jacket, overcoat, etc), to sag, to hang low"
Inha (adj),without much liquid (curry)
Inhai (n),"dizzy, to become old and lost memory"
Inhak (v),drying things over a traditional Hmar fireplace
Inhâk (v),"to swallow the wrong way, or so as to choke, to catch one's breath"
Inhal (v),"to quarrel, to abuse one another"
Inham (v),"yawn, yawning"
Inhawi (v),to response to a voice call
Inhawk (adj),"eager, willing to"
Inhawmthaw (v),to be so conscious and dedicated in one’s job in hand
Inhawrkhawm (v),to gather together
Inhêk (v),to complain or sue each other in a court of law or to competent authority; slanting
Inhèl (v),"to encircle each other, to avoid each other for physical contact"
Inhêm (v),to turn left or right or back
Inhen (v),"to be equal, to equal one another"
Inhersuok (v),"to rise (sun), to arrive (time or event)"
Inhil (adj),"nearly dry, dry on the top (as mud)"
Inhîp (v),to attract each other
Inhlan (v),to hand over or pass on
Inhlansawng (v),"to pass on from one to another, to hand over"
Inhlaw (v),to earn a living on contract or daily basis
Inhlawfa (n),"a hireling, one who works for wages (v), to work for wages"
Inhlèm (v),cheating one another
Inhlemna (n),"fraud, trick, deception"
Inhli (adj),crops or plants those that grows without planting or sowing
Inhliem (v),"to be wounded, to wound oneself, to be injured"
Inhlieu (v),"swim, swimming"
Inhlip (v),"to flay, to split (as skin), to skin"
Inhlukhum (n),a woman forcing herself to a man’s house to be his wife without being legally married; to enter the enemy’s fortress and siege
Inhlùm (v),to roll down; to roll up (cotton)
Inhlúm (adj),"round, spherical"
Inhlut tuo (v),respecting or giving regards to each other
Inhma (adj),"early, soon"
Inhmaih (v),"to forget each other, to unintentionally left out"
Inhmaiton (v),to be face to face
Inhman (v),"to have leisure, to have time, to be ready"
Inhmang (adj),lost
Inhmang (v),"being involved in one activity or the other (social, church, etc)"
Inhmangai (v),"to love each other, loving one another"
Inhmat (adj),"sticky, splatter"
Inhmaw (v),"hurry, to hasten, to be quick, etc"
Inhmawtakin (adv),"hurriedly, quickly, hastily"
Inhme (adj),"matching, suitable with, harmonious with"
Inhmelhriet (v),"to get to know each other, knowing each other"
Inhmelhriettir (v),to introduce to
Inhmelmak (v),"to hate each other, to be enemy to each other"
Inhmelmakna (n),enmity
Inhmu (v),to meet each other physically; to agree to each other
Inhmui (adj),a nice smell
Inhmui (n),name of a fruit bearing tree
Inhmuntriek (n),a leafy edible plant
Inhmur (v),"to sulk, to show a sulky face with the lips stretch out"
Inhmusuok (v),to become conscious or aware
Inhmuthiem (v),to understand one another
Inhna (n),a wild thorny leaf use for roofing in Hmar traditional house
Inhnai (adj),"close, near to each other; to have a pus (on injured body)"
Inhnâk (adj),"sticky, adhesive, gummy, gluey"
Inhnam (v),"to smell, to sniff"
Inhnamhnoi (v),"involve, to get involve"
Inhnar (v),"to covet, to want very much"
Inhnâr (v),"snore, to snore, snoring (of the nose when sleeping)"
Inhnarum (n),"desirable, enviable"
Inhnawm (v),to relief oneself from nature’s call
Inhnek (v),boxing
Inhnem (v),to console oneself or someone else
Inhniek (v),"to sob, to snivel"
Inhnik (adj),"good, nice (taste or smell), tasty, etc"
Inhnikna (n),"in which one pays attention to, one’s interest, one’s concern; taste"
Inhning (v),"to shake, shaky, to wave"
Inhnok (adj),"dirty, in a mess"
Inhnop (adj),"unclean, impure"
Inhnot (v),chasing one another
Inhnu (adj),"late, being late, to be late"
Inhnuoi (adj),"low, not high"
Inhoi (adj),"comfortable, pleasant, pleasurable, comfortable, etc"
Inhoi chen (v),"to enjoy pleasure, to revel, to enjoy luxury"
Inhoi lo (adj),"unpleasant, uncomfortable"
Inhoi ti (v),to feel comfortable
Inhoi ti takin (adv),with great pleasure
Inhong (adj),being receptive
Inhra (n),cramp
Inhram (v),sound or cry given out by animals or birds
Inhran (adj),moving out from the main house to a new one to be a separate family mostly by a son after marriage and children
Inhrem (v),to punish
Inhremna (n),punishment
Inhrep (v),cutting down (a log) bit by bit
Inhriet (v),to know each other
Inhriettir (v),"to make it known, no notify"
Inhriettirna (n),a notice
Inhril (v),"to teach, to make someone understand"
Inhro (v),"to dry, to season"
Inhrol (adj),"large, huge (in size)"
Inhrom (adj),"rough, tough (in behaviour)"
Inhron (v),to be on the opposite side of each other
Inhrosa (v),"to assert oneself, to boast"
Inhrotrawl (v),"to dry, to season"
Inhruk (v),to wipe or rub oneself
Inhrukna puon (n),"a towel, a cloth for wiping off perspiration"
Inhruoi (adj),"sticky, soft"
Inhûi (v),to call each other using sign language or the hand
Inhukpui (v),to be over possessive on ones belonging or property
Inhuol (v),"to surround (animal) in hunting, etc"
Inhuol (v),"to be affianced to each other, to engaged each other for marriage"
Inhuolna (n),engagement for marriage
Inhuom (v),to be ready or willing
Inhuon (v),"to fence, to make boundary wall around"
Inhuot (v),to scratch oneself
Inhuot (n),restless (person)
Iniei (v),"to be dissatisfied with oneself, to feel oneself small when compared with others"
Iniel (v),to feel extreme pain
Iniem (n),"pride, egotism, conceit"
Ininhnik (v),"to be fast asleep, to sleep properly"
Ininnghil (v),to die
Inip (v),to hold one’s breathe
Inirh (v),to hiccough
Inkaisawng (v),to inflict (disease) from one to another
Inkaisawngthei (n),communicable (disease)
Inkâk (v),"split, come apart"
Inkal (v),to oppose each other; to make a rough sketch
Inkalna (n),"contradiction, disputation"
Inkam (v),"to stand up for or by one another, to help"
Inkamki (v),"to mutually support or hold up, to be mutually dependent"
Inkâng (v),"lifted on the upside, being lifted up"
Inkâp (v),"to fight, to shoot at one another"
Inkapna (n),"a fighting with fire arms, an exchange of fire, a battle"
Inkar (adj),in between
Inkarakik (adj),far off
Inkarthlakin (adv),"one after another, in sequence"
Inkausa (adj),ever ready
Inkawkal (adj),crossing one another
Inkawl (n),the bamboo pole spread over a Hmar traditional house to give extra protection from strong and violent storm
Inkawng (v),"swollen, bruise, blister"
Inkei (v),pulling each other (like in ‘tug of war’)
Inken (v),giving space to someone
Inkhâi (v),"hang, hanging"
Inkhaithli (adj),"smart, slim"
Inkhal (v),"to freeze, to turn into ice, to get frozen"
Inkhâm (n),promise under oath
Inkham (v),to place anything long in a more or less horizontal position either on the ground or with one end on the ground and the other slightly raise
Inkhan lo (v),"to be different, to bear no comparison to one another"
Inkhang (v),to places (anything long) in a more or less horizontal position
Inkhap (v),to restrict
Inkhapna (n),restriction
