Word,Description
Matheilovin (adv),"certainly, without fall"
Matrau (n),name of edible fruit (also called ‘sarzuk’
Mauhak (n),"a patch of bamboos not to be jhumed, but preserved for building purposes"
Mauruo (n),a poetic word of bamboo
Mautam (n),a famine caused by bamboo flowering that occurs after every 50 years in Mizoram and Manipur state in particular (the last one is in 2006)
Maw (adj),responsibility
Maw (interrogative article),is it?
Maw inphurtir (v),to give responsibility to
Mawi (adj),"pretty, to be pretty, beautiful, exalted, honoured, to be fit or proper"
Mawi lo (adj),"ugly, unattractive"
Mawih (v),"to decay, to rot, to putrefy"
Mawihnai (adj),"good looking, nice"
Mawk (adj),"invisible (moon); dark, an attractive colour"
Mawl (adj),"simple, plain, to be plain, to be without adornment, without common sense, foolish, blunt"
Mawm (adj),"fat and chubby, healthy looking (especially babies)"
Mawmaw (n),"momo (a type of South Asian dumpling native to Tibet, Bhutan, Nepal, North and Northeast India)"
Mawn (n),the girl’s clitoris
Mawn (n),mound (40 kgs)
Mawng (v),"to sprout, to come to life (like a plant)"
Mawng (n),the buttock
Mawng rik (n),one who is slow and reluctant to stand up and work
Mawng zang (n),one who is always active and ready to stand up work
Mawngkapna (n),enema
Mawngkuo (n),"the anus, the rectum"
Mawngkuohur (n),"a gay, a sodomite, sodomy, one who practises sodomy"
Mawngtam (n),the buttocks
Mawphur (v),to bear the consequences or blame
Mawphurna (n),responsibility
Mawphurtu (n),"one who is responsible for, one who is to bear the blame"
Mawsala (n),"spice, spices"
Mawsie (adj),"blame falsely, to lay blame upon"
Mawt (n),banana
Mawtor (n),motor
Mawza (n),a Hindi originated term for socks
Mazu (n),a mouse
Mazu mei and (adj),that which declines till the end like a rat tail
Mazuek Hmarcha (n),bird’s eye (chilli)
Mazupui (n),"a hare, a rabbit, a full-grown female rat"
Mei (n),"fire, a tail, the stern of a boat"
Mei awi (v),to warm oneself by the fire
Mei mei (adv),"merely, uselessly, gratuitously, undeservedly, simply, causelessly"
Mei nei (v),to contain or have a sinister meaning
Mei pek silai (n),a match lock gun
Mei sem (v),"to light a fire, to blow a fire"
Mei ti (v),to tend a fire
Mei zap (v),to wag the tail
Meiai (n),the red-hot live ember
Meibitling (n),the narrow line on human back that leads to the anus
Meichok (n),"a flame, a blaze"
Meichok en (v),a situation of extreme poverty wherein one is left with nothing to cook but just look at the fire in the hearth
Meihawp (n),"smoking, one who smoke"
Meihawp mi (n),smoker
Meihol (n),charcoal
Meikang threl (v),to extinguish fire
Meikhu (n),smoke
Meikhu long (n),a steamboat
Meikhu suokna (n),a chimney
Meiling (n),"live embers, a live coal, a red hot piece of wood or coal"
Meilum (n),the warmth of fire
Meipar (n),"mayflower, gulmohar tree"
Meipek silai (n),a match lock gun
Meiphu (n),an impoverished moveable container of heated charcoal that gives warmth
Meipui (n),a bonfire anywhere outside a house
Meisem par (n),a variety of flower
Meiser (n),"a torch (usually made of some dry split bamboo), a firebrand"
Meiser sit (v),to lit ‘meiser’ (and walk)
Meisi (n),a spark
Meitawk (n),"a flint, lighter"
Meitehem (n),a constant follower
Meitei (n),a Manipuri
Meithallawn (n),"fireworks, a rocket"
Meivam (n),ashes
Meivam inkhawlna (n),ashtray
Meizang hlaptu (n),the one who is mainly responsible for a particular job
Meiziel (n),cigarette
Mekzin (n),magazine (gun)
Mel (v),"to stare at, to look at steadfastly, to stare"
Mel (v),mile
Mellung (n),milestone
Memorandam (n),memorandum
Mena thlak (v),"to regard as venial or pardonable, condonable"
Meng (v),"to wake, to be awake, to open (as eyes)"
Meng rum (v),to gaze with open angry eyes
Mengphawk (v),to open the eyes wide due to fear or extreme surprise
Mengpui (v),to sit up at night with (especially sick person)
Mengruk (v),to secretively open the eye (especially during prayer)
Mengte (n),cat
Mengte nau nei ang (phrase),one who keep on shifting his place or dwelling place like a cat did with her kitten
Mengte te (n),kitten
Mep (n),map
Mesie (n),Messiah
Met (adv),expression of doing a little bit
Met (v),"to scrape, to shave, to cut (the hair), to flay the skin"
Meu khom (adv),even
Mi (n),"a person, a man, a thing, one"
Mi (prn),"me, for me, at me"
Mi ang lo (n),"to be unlike an ordinary man, mad, imbecile, mentally deficient"
Mi behna pet (v),"to disturb somebody, to give a repercussion effect to somebody"
Mi in (prn),by someone
Mi intang (n),a prisoner
Mi invet (n),"a fool, an idiot, a silly person, a mad person"
Mi khelhlip (n),"a liar, a miser, a niggard"
Mi mittlung (adj),satisfying to others
Mi nazong (n),"everybody, all and sundry"
Mi po po (n),"all people, everybody, all and sundry"
Mi ta (n),belonging to another
Mi tinreng (n),"everyone, every people"
Mi uongthuong (n),"a boaster, a braggart, one who always boast of himself"
Mi veivak (n),a passer-by
Mi verther (n),a hypocrite
Mi vervek (n),"a treacherous, a deceitful person"
Mi zakzum (n),"a bashful man, a shy and timid person"
Mi zawmthaw (n),"a sluggard, a lazy or slothful person"
Mi zuonzang (n),"a nimble person, a lively and agile person"
Midang (n),a Hmar Khawlhring sub clan
Midawizep (n),coward
Mifel (n),a smart and useful person
Mifere (n),"a dwarf, a stunted person"
Mihlun (n),a senior and respectable person
Mihrang (n),"a warrior, a brave man"
Mihriem (n),a human being
Mihriemate (n),a Hmar Lungtau sub clan
Mikhuol (n),"a stranger, one belonging to another village"
Mikhuol pindan (n),a guest room
Mil (v),"to match, matching, to put it right"
Milai (n),a Hmar Khawlhring sub clan
Milim (n),"a picture, a portrait, an effigy, an idol, an image, a tableau"
Milim bie (v),to worship idol
Milim biekna (n),idolatry
Milim bietu (n),"an idolater, worshipper of idol"
Milim ziek (v),"to draw a picture, to paint a picture"
Milim ziekna (n),a paint brush
Milim ziektu (n),"a painter, an artist"
Mimal (n),an individual
Mimawl (n),a simple and unwise person
Mimhnak (n),a variety of maize
Mimir (n),"the commoners, the general public"
Mimkei (n),"a landslip, landslide (v), occurrence of landslide"
Mimpum (n),a single grain of maize (of the famous Liendo folktale)
Mimtukthla (n),the month of December
Minaran (n),"an ordinary man, ordinary people"
Mingo (n),"a white man, an Englishmen"
Minister (n),minister
Minu (n),"a female, of feminine gender"
Mipui (n),a crowd
Mirawng (n),a Rongmei Naga
Miril (n),"a scholar, intellect"
Mise (n),"a fly, a mosquito"
Misie (n),a poor man
Mistiri (n),a Hindi originated term for craftsmen (in house construction) or carpenters
Misuol (n),"a quarrelsome, foolish, or bad person, a sinner"
Mit (n),the eye
Mît (n),the gall bladder
Mit âr intra (phrase),expression of tremendous fright with wide open eyes as like that of a hen encountering a centipede
Mit chau (adj),myopia
Mit dumpawl (n),the iris of the eye
Mit fim (v),to be keen-sighted
Mit inhnawm (v),to have some outside particles in the eye
Mit inlen (v),to wide open the eye and have a far view
Mit inlen (v),to look round about
Mit insim (v),to shut the eyes
Mit invai (v),"to be dazzled, to see one thing as if it were another, to see indistinctly"
Mit khap (n),"the blink of the eye, a moment"
Mit khap kar (adj),"in an instant, instantaneously, in the twinkling of an eye"
Mit khing siai (v),"to wink, to shut one eye"
Mit ko (n),the eyebrow
Mit la (v/adj),"to take the fancy of the eye, attractive, enticing"
Mit nauleng (n),"the pupil, the apple of the eye"
Mit siai (v),"to wink, to shut one eye"
Mit sirin mel (v),to watch out of the corners of the eyes
Mit suk vai (v),to dazzle
Mit tlang kawm (n),the edge of the eyelid
Mit tlung (v),to be pleasing in the sight of (others or someone else)
Mit vai (v),"to be dazzled, to have the eyes dazzled"
Mit var (n),"keen-sighted, to be keen-sighted"
Mit var nawk (adv),to receive sight (again)
Mit vun (n),the eyelid
Mit vun chuor (v),to frown
Mita hmuthei (adj),visible
Mita hmuthei lo (adj),invisible
Mitang (n),a prisoner
Mitawrot (n),"a ruthless person, a cruel person"
Mitdawivai (v),"to conjure, to deceive the eyes"
Mitdawivai thiem (n),"a conjurer, a magician"
Mitdel (n),a blind person
Mitfere (n),"the name of a fly, the discharge on the lashes during a cold in the eye"
Mithehre (n),"dwarf, a dwarfed man, a dwarf woman"
Mithi (n),"a corpse, a dead person"
Mithi khuo (n),the abode of departed spirits
Mithi ngai (v),"to mourn for the dead, to miss someone who is no more"
Mithi ral (v),"to visit those who are mourning (mostly before the burial), attend to a burial ceremony"
Mithmul (n),the eyelashes
Mithrubi (n),a variety of edible plant found mostly in Manipur valley
Mitilre (n),"a eunuch, a castrated man"
Mitkal (v),a cross eyed
Mitkhetral (n),child kidnapper
Mitliem (n),jaundice
Mitmei hmu (v),to have the approbation of
Mitmei veng (v),to watch the behaviour and manner of others
Mitmei veng thiem (n),one who know how to read a person’s thoughts by his manner
Mitmeng zie (adj),"behaviour, manner"
Mitmu (n),the eyeball
Mitmu dum (n),the iris of the eye
Mitnghal (n),one who looks here and there and change his behave accordingly
Mitpuol (v),to have a sty on the eyelid
Mitthla (n),imagination
Mitthli (n),tears
Mitthli tla (v),to shed tears
Mittlangkawm (n),the eyelid
Mittungkak (n),a species of wild boar (lemur – slow lorries)
Mitvaidawi (n),a magic
Mitvaidawi thiem (n),"a conjurer, a magician"
Mivar (n),wise person
Mizie (n),"what a person or man is, the character of a person"
Mizo (n),name of a conglomeration of tribes
Mo (n),"a bride, a son's or brother's wife"
Mo biek (v),an approach to a girl’s family by a boy’s family for marriage proposal
Mo fam (n),articles brought by a bride for the sisters of the groom in a Hmar marriage
Mo inlawi (v),traditional send-off ceremony of a bride (family affair)
Mo inthla (v),"sending off ceremony of a bride, a blessing ceremony"
Mo lawm (adj),"a marriage celebration, a wedding reception"
Mo thilsom (n),dowry
Mo thrien (n),maid of honour or the friend of a bride who stands as witness on her wedding day and accompany her on her maiden entry to her husband's house
Mo thruoi (v),leading ‘mo’ out of her father’s house by groomsman and sisters of the groom
Moih (adj),"decay, rotten, to be rotten"
Mol (adv),"assuredly, certainly, specially"
Mom (adj),"fat and chubby, healthy looking (especially babies)"
Moneitu (n),"bridegroom, the groom"
Mong (n),"the bottom of anything, the posterior, the mouth of a river, the buttock"
Mong rik (n),one who is slow and reluctant to stand up and work
Mong zang (n),one who is always active and ready to stand up work
Mongbieng (n),the buttocks
Mongkapna (n),enema
Mongkuo (n),"the anus, the rectum"
Mongkuohur (n),"a gay, a sodomite, sodomy, one who practises sodomy"
Mongtam (n),the buttocks
Mongvuoi pom (v),a young woman marrying an old man
Mor (v),to give pressure (from inside)
Motor (n),motor vehicle
Mu (n),"the eagle, a hawk, a falcon, a kite"
Mu (n),"a seed, a kernel, bullet"
Muarla (n),the black eagle
Mubuong (n),the blue eagle
Mudum (n),the black kite
Muhreu (n),name of a species of eagle
Muk (adj),"pressed tightly together, close together, prosperous"
Mukthing (n),the name of a tree with large round leaves and small fruit
Mulep (n),the spokes of a wheel or drum
Mulukol (n),a vulture
Mum (adj),"round, cylindrical"
Mum (v),beginning to form in the bud (as rice)
Mum (n),tablet (medicine)
Mum pal (adv),perfectly cylindrical
Mumal (adj),"definite, precise, distinct"
Mumal bo (adj),"baseless, unfounded"
Mungek (n),a species of owl
Muol (n),"a mound, a hill, a spur (of a hill)"
Muol dung (n),"a spur (of a hill), a hill range"
Muol eng hmu phak (n),somebody who is above the commoners
Muolhoi (n),the litchi fruit
Muolkhang (n),a spur of hill crossing another spur
Muolkil mithra (n),the chief cabinet member of a village
Muolliem (v),to go away literally meaning death
Muollukhim (n),a small hillock or mound between two hills (Pre-Christian Hmars believed that these small mounds have an occupant or evil spirits and therefore offer sacrifice so as to please or not displease it)
Muolpawng (n),"a hillock, a mound of a hill"
Muolphei (n),a Hmar Khawbung sub clan
Muolpho (v),"to be put to shame, to be humiliated"
Muolpho thlak (adj),"humiliating, shameful, disgraceful"
Muolphona (n),"shame, disgrace, humiliation"
Muolsom (n),name of a Hmar kindred (unau-suopui) tribe settled in Mizoram & Tripura
Muolvai (n),name of fruit (of citrus family)
Muolveng (n),the part of a village round the chief’s house and village square
Muong (adj),"to be slow, leisurely, to take things quietly"
Muongchang (adj),"to be slow, leisurely"
Muongchangin (adv),"slowly, with no hurry"
Muonglei (n),"a place free from danger, a safe place, a place of safety"
Muongna (n),"peace, safety, calmness"
Mupheng (n),name of a variety of eagle
Mupui (n),an eagle
Mûr (n),cell
Mura (n),"myrrh, incense"
Murakek (n),"eternity, time immemorial, endless ages past"
Mûrna (n),where one grows
Murna (n),where and how one grew up
Musen (n),the red kite
Musep (n),a gun’s small bullet
Musep (n),type of a gun
Musie (n),vulture
Mût (v),"blow, to blow"
Mutchok (v),to blow into flame (with the mouth)
Mute (n),the red kite
Muthlakawi (n),a Hmar traditional shawl worn by both men and women
Mutmaleng (n),name of a variety of plant
Mutpuom (v),"a balloon, bladder, etc"
Mutthal (n),a small weapon of a bamboo pipe and sharp object operated by blowing from the mouth
Muvanlai (n),a hawk that mostly preyed on snakes
Na (n),"ear, the outside (of bamboos, etc), pain, ache, hurt"
Na (v),"to be sick, in pain, ache, hurt, pain"
Na (adj),"painful, hurtful, boisterous, scorching, intense"
Na chin (adv),whence (but only when ‘na’ is a suffix of the previous word)
Na dingin (prep),"for, for the purpose of"
Na ek (n),earwax
Na inbuo (v),to have a purulent discharge from the ear
Na na na (adj),"just as, exactly as"
Na nei (adj),"to be stringy (as beans, etc)"
Na phawtah (adv),"wherever, wheresoever"
Na sit (v),to listen carefully
Na sukset (v),to pretend not to hear
Na ti (v),to feel pain
Naa cham (v),to remember vividly sound or voices which once heard
Naa hrie (v),to hear with the ear
Nabe (n),a woman’s earring
Nachâng (n),"common sense, instinct"
Nachang hrie (v),"to have the sense, common sense"
Nadâr (n),the ear drum
Naga (n),name of conglomeration of tribe
Nâk (n),"the ribcage, the side (parts of human body)"
Nak a lai (adv),over and above
Nak nem (n),the side between the top of hip bone and the lowest rib
Nak sapah (adv),"in addition to, over and above, moreover, besides"
Nakawr (n),the ear
Nakie (adv),afterwards
Nakie khan (adv),a short time ago
Nakie pha (adv),a short time after
Nâkru (n),"a rib, the ribs"
Nakuo (n),the ear hole
Nakuo inbuo (n),otorrhoea
Nakuoek (n),"ear wax, cerumen"
Nal (adj),"nice, neat, tidy, stylish"
Nâl (adj),"slippery, smooth, to be slippery, etc"
Nàl (v),"to smear, to rub on"
Nala (n),"nullah, a drain, drainage"
Nalduok (n),"okra, ladies’ finger"
Nam (v),"to push, to knock against"
Nâm (adj),"smooth, to be smooth"
Nam (v),"to smell of, to give forth a smell, to be high, to be strong smelling"
Nam liem (v),to push over the edge
Namai (adj),"ordinary, common, any sort of, every sort of, all sorts of"
Namai lo (adv),"not ordinary, worthwhile, superb"
Nambar (n),number
Nambar 4 (n),"No. 4, heroin, drug"
Namdet (v),"to confirm, to reaffirm"
Namen (adj),"ordinary, common"
Namen lo (adj),"extraordinary, uncommon"
Nameu (adv),it is very much
Namnghet (v),"to approve, to ordain"
Namnghetna (n),"approval, confirmation, ordination, verification"
Namnûl (v),to do a thing anyhow even without seriousness
Nampui (n),a Hmar Biete sub clan
Namthlak (n),an elevated floor usually towards the lower side of a Hmar traditional house
Namthlûk (v),to push down
Nang (v),"to be in time, to meet"
Nang (prn),"you, thou, thine, thee"
Nang I ta (prn),thine (singular)
Nangching (v),assail or set upon when at a disadvantage position
Nangin (n),by you
Nangma (prn),"thou, thy, thee (singular)"
Nangni (prn),your (plural)
Nangni ta (prn),yours (plural)
Naran (adj),"ordinary, common, any sort of, every sort of, all sorts of"
Nars (n),nurse
Nasa (adj),"exceeding, immense, intense"
Nasa takin (adv),"exceedingly, tremendously, vehemently"
Naset (n),deaf
Naset (n),"deaf, a hearing impaired"
Naset um (adj),noisy
Naspati (n),the pear fruit (see also ‘perthei’)
Nat (n),"pain, ache, pain, ill"
Nát (n),name of a wild tree
Nathlep (v),"to disappoint, displease"
Natil (n),the earlobe
Natna (n),"sickness, disease"
Natna (n),"disease, ailment"
Nau (n),child
Nau (n),"the young of animals, birds, etc."
Nau awi (v),to hush a child
Nau awi hla (n),a lullaby
Nau dom (v),to deliver a baby
Nau don (v),to attend a child
Nau inphir (n),twins
Nau insiet (n),to have a miscarriage
Nau nei (v),to give birth
Nau neilo (adj),childless
Nau pai (v),"to bear a child, to be pregnant"
Nau ruol (n),"many children, a family with many children"
Nauban (n),an orchid
Naubawm (n),the placenta with its membrane
Naudontu (n),a baby sitter
Nauhase (n),to labour with child
Nauhron (n),an adopted son or daughter
Naulai (n),a variety of wild tree
Naulutir (n),the eldest child
Naumitlum (n),the youngest child
Naunu (n),a daughter
Naupa (n),a son
Naupang (n),"a child, a boy, a girl"
Naupang lai (n),childhood
Naupang lawm (n),"anything to give pleasure to a child (present or gift, etc)"
Naupangte (n),a young boy or girl
Nauphir (n),twins
Naupuonpuok (n),a shawl used for carrying babies on one’s back
Nausam (v),to deride or scoff at
Naute (n),"an infant, a tiny baby"
Nautesen (n),a very tender baby
Nauthak (n),"the name of a small tree, the flowers of which grows along the branches"
Naval (n),hooks (earlobe)
Naw (adv),not
Naw ro (adv),"ending words to meant – do not, don’t"
Naw sien (adv),"ending words to meant – let he/she not, let it not, let them not"
Naw top (adv),"under no circumstance, not at all, in no wise, not in the least"
Nawchizor (n),"a harlot, a prostitute, a whore"
Nawh (adv),not
Nawi (adj),"small pieces, small change"
Nawk (adv),"again, once more"
Nawk hlak (adv),"again and again, over and over again, repeatedly"
Nawk zuol (adv),more
Nawlpui (v),in a large group
Nawmna (adv),"carelessly, negligently, lightly, simply"
Nawn (v),repeat
Nawn nawk (adv),repeat again
Nawr (v),push
Nawt (v),"to rub, to scour"
Nawt tle (v),to polish
Nawtchok (n),a matchstick
Nawtchok bawm (n),a match box
Nawtfai (v),to clean by scouring or rubbing
Nawtfe (n),a variety of big bean (the dry fruit of which is used to rub dishes when washing)
Nawtlung (n),a rough stone use to rub human skin or body
Nazong (adj),"ordinary, common, any sort of, every sort of, all sorts of"
Nazongin (adv),"whenever, wherever"
Ne (v),to suck (as babies do their mother’s breast)
Nei (v),"to get, to have, to obtain"
Nei po po (n),"one’s all, all what one have, all what one possesses"
Nei zawng (n),the kind of thing one possesses
Neichirh (n),a sub clan of Hmar Lusei
Neingaite (n),a Hmar Leiri sub clan
Neinung (adj),"well to do, wealthy, prosperous, rich"
Neisun (adj),"only, the only one possesses"
Neitham (n),a Hmar Zote sub clan
Neitu (n),an owner
Nek (v),to press against with force
Nek (v),to suck (the breasts)
Neksawr (v),"to oppress, to ill treat"
Nel (v),to cover with soil
Nel (adj),"to be used to, to be familiar with, to be not afraid of"
Nelhau (n),name of the many non-fatal but playful spirit the pre-Christian Hmar believes to exist
Nelhau rawihai (n),the disciples or followers of Nelhau
Neltakin (adv),intimately
Nelum (adj),"genial, friendly"
Nem (adj),"soft, mild, weak, gentle, tender"
Nemrangpuon (n),name of a variety of Hmar women shawl
Nene (n),"the bosom, the breasts, udder, milk"
Nene hmur (n),"a nipple, a teat"
Nene ne lai (n),those who are still being fed with milk
Nene sawr (v),"to milk (a cow, etc)"
Nene tui (n),the milk
Nenginnawi (n),used to refer to those people who are too meticulous
Nengnawi (n),"small items, small particles"
Nep (adj),"childish, unworthy of"
Nep (v),"to ask a smaller price higher than the right value, to offer a price than the one quoted"
Nepnawi (adj),"odd, petty and miscellaneous, small, tiny, little"
Ner (v),to forcefully go through (a fence)
Nerthleng (v),to succeed in going through (a difficult test)
Nga (n),fish
Nga (adj),five
Nga (v),"to have, to carry out, to accomplish"
Nga fuon (v),a gathering of small fishes for spawning
Ngabawng (v),a variety of fish
Ngabuol (v),a variety of fish
Ngachaiche (v),a variety of fish
Ngachangpan (v),a variety of fish
Ngachuon (v),a variety of fish
Ngadawi (v),a variety of fish
Ngadawl (v),a variety of fish
Ngadawntriel (v),a variety of fish
Ngahâr (v),a variety of fish
Ngahra (v),a variety of fish
Ngahrangchal (v),a variety of fish
Ngai (v),"to listen, to obey, to take notice of, to think, to consider, to wait for, etc"
Ngai (v),"to long for, to long after an absent one"
Ngai (adj),"the same, identical, not different"
Ngai aw nawk (v),to be restored to former condition
Ngai lo (adj),not necessary
Ngai naw nih (n),not necessary; it’s OK
Ngai naw tienga ngai (v),"to take it the other way round, to take offence at, to misunderstand"
Ngai nawh (adv),"never, at any time, not ever"
Ngai rawh! (intjn),listen! behold!
Ngai ta (intjn),listen! hark! behold!
Ngaia nei (v),"to become accustomed, to get accustomed to, to take things for granted"
Ngaibawk (n),the front side roof end of a traditional Hmar thatch house which usually is a favourite spot for swallow and other birds
Ngaichang (v),"to wait for, to wait"
Ngaidam (v),"to pardon, to forgive, to condone"
Ngaidamna (n),"forgiveness, pardon, absolution"
Ngaidan (n),"opinion, idea, thinking"
Ngaidi (n),"wild elephant grass, thatch"
Ngaidi in (n),a thatch house
Ngaihlu (adj),"to think much of, to value highly, to esteem"
Ngaihruina (n),"a souvenir, a memento, something prepared for someone as a parting gift item for remembrance"
Ngaikawi (v),to put a wrong construction upon
Ngailungher (v),"no more in love with, to break up the relationship"
Ngaimaw (adj),"expressing or showing serious concern, to think much of, to value highly"
Ngaina (adj),"to be fond of, to like, to set great store by"
Ngaina hrie (adj),to know how
Ngaina reng hre lo (v),"to not know what to do, to be in a fix, to be at a loss, to be in suspense"
Ngaina reng hre loa siem (v),"to put in a fix, to hold in suspense"
Ngainatum (adj),"likeable, loveable, desirable, admirable"
Ngainep (v),"to despise, to contempt"
Ngaingam (adj),"to be at peace, without worry"
Ngainuom (adj),"interesting, pleasant to hear, willing to hear"
Ngainuom um (n),anything pleasant to hear (a nice story)
Ngairuk (v),"to eavesdrop, to secretly listen someone else’ conversation"
Ngairuong (n),"elephant grass, name of a variety of wild-big grass"
Ngairuot (v),"to calculate, to guess, to reckon, to put on one side for a set purpose"
Ngairuotna (n),"a guess, estimation, imagination"
Ngairuotnain (adv),"according to calculation, reckoning, or guess"
Ngaisak (v),"to regard, to have respect to or for, to heed, to care about, to care for, to show respect to or for"
Ngaisak lo (v),to disregard
Ngaisam (adj),"heedless, careless, taking things lightly"
Ngaisang (adj),"to give respect, to regard; to be interested in, to take interest in"
Ngaisang tlak (adv),worth respecting
Ngaisang um (n),respectable
Ngaitak (n),beloved
Ngaite (n),a Hmar Zote sub clan
Ngaitha (adj),"neglect, not attentive, not taking care of, not giving attention to"
Ngaithiem (v),"to understand, to comprehend"
Ngaithiem lo (v),"to misunderstand, to resent at"
Ngaithla (v),"to listen, to give heed to, to hark"
Ngaithlak (v),"to listen, to give heed to, to eavesdrop"
Ngaituo (v),"to consider, to ponder, to be anxious"
Ngaituo zing (v),"to remember, to keep in mind"
Ngaituona (n),"thoughts, consideration"
Ngaituopui (v),"to advice, to ponder over with"
Ngaium (adj),"likeable, pleasant, remembering, worth missing"
Ngaiven (v),"to watch, to keep guard over, to look after, to listen to"
Ngaizawng (n),"one’s lover, girlfriend, boyfriend"
Ngak (v),"bark, a dog’s bark"
Ngakara (n),name of a variety of fish
Ngakhing (n),name of a variety of fish
Ngakhuoi (n),name of a variety of fish
Ngakulram (n),name of a variety of fish
Ngakuoi (n),a fish-hook (v) fishing
Ngakuoi kam (v),angling; to fish with fishing rod and hook
Ngakuoi ngul (n),a fishing rod
Ngal (n),the shin
Ngal hrat (adj),"brisk in walking, fast walking, present everywhere"
Ngal kuol (n),bowlegged
Ngal ru (n),"the tibia, the shin bone"
Ngal sok (v),a contrivance made by boys to hit people on the leg as they walk along the path
Ngalchar (n),the centre and thin-skin portion of the shin
Ngaler (n),name of a variety of fish
Ngalha (n),name of a species of palm tree
Ngalim (n),the name of a variety of small fish
Ngalpui (n),the name of a stinging bee
Ngalrang (n),the name of stinging bee
Ngalungbet (n),name of a variety of fish
Ngalzem (n),a pad woven around the shin for protection
Ngam (v),"brave, daring, tame, to be brave, to dare, to gain a victory, to be prepared to do a thing, to be not afraid of"
Ngam (adj),"tamed, domesticated"
Ngameihol (n),name of a variety of fish
Ngameisui (n),name of a variety of fish
Ngami (n),a species of large cat-fish
