Word,Description
Sîng (adj),"short in length or height (women skirt, petticoat, etc)"
Sîng (adj),ten thousand
Singgal balu (n),sandstone chips
Singin (n),poetical term for palatial and big house
Singkawna (n),cinchona
Singkilik (n),"a wart, a mole (in human body skin)"
Singkip (n),a species of house spider
Singmit (n),a poetical word for eye
Singsa (v),"to prepare, to get ready, to make preparation, to make arrangements"
Singsang (n),name of ant which built its nest on leaves
Singtur (n),the name of a species of bamboo used for making the bowls of men's pipes
Singtur dumbel (n),a smoking pipe made of 'singtur'
Sîngzu (n),a Meitei originated term for a mixture of certain green vegetables and leaves to be eaten in raw
Sîngzuor (n),name of thorny vegetable
Sinlung (n),the place where Hmars claimed themselves to have originated
Sinna (n),"cover, lid, cork"
Sinsie (v),"to fix in the mind, to take special notice of so as to remember"
Sip (adj),full to the brim
Sîp (n),"top most, zenith"
Sipai (n),a soldier
Sipawikap (n),the name of a constellation comprising of seven stars
Siper (n),"an offshoot, anything divided off from the parent stock (eg, a hamlet village)"
Sipisial (adj),special
Sipsam (n),the hair of the crown of the head
Sipsuon (v),to carry or put on the head
Sipui (n),a species of sesame
Sipzawn (n),a measure of a conical heap of paddy the apex of which will be level with the crown of an ordinary sized man's head
Sipzum (n),"the sharp point (of a knife), a pointed top (of a church cross)"
Sir (v),"to tread upon, to tread (with the bottom of the foot); to visit, to call upon"
Sîr (n),"the side, corner (of anything)"
Sir tinah (adv),every corner
Sir tuok (adv),on each corner
Sirah (prepn),"on the side of, at the side of"
Sirbi (n),"notches made in a tree or hill to assist in climbing, steps of stairs"
Sirbuksum (n),a rice mortar (using the leg)
Sirde (v),"to trample upon, to oppress, to hold in bondage, to look down upon, to despise"
Sirdo (n),inflammation on the sole of the foot cause by excess walking
Sirins (n),syringe
Sirni (n),trowel (of mason or house builder)
Sirsan (n),"a support for the feet used when weaving, a footstool, to rest the feet upon"
Sirsawn (v),"on the left or right side, to be on or put on the left or right side"
Siruk (n),the Pleiades
Siruk lain (n),the final assault in games - reel or real life (derived from one of the latter but most severe and violent norwesters (storm or hurricane) of India and Bangladesh that synchronize with the heliacal setting of the Pleiades)
Sîrva (n),poetical name for birds
Sise (adj),the details
Sise takin (adv),"in minute details, particularly"
Sisêp (v),"to winnow, to remove the chaff and the broken pieces"
Sistem (n),system
Sistemetik (adj),systematic
Sisu (n),name of fruit (citrus family)
Sit (v),"to light a lamp, to lit a torch, etc"
Sit (v),to be dissatisfied with
Sitensil (n),stencil
Sithu (n),fermented sesame seed
Sithuum (n),the dry gourd in which ‘sithu’ is being stored
Situi (n),a small pond in wild flat forest or small valley
Sizo (n),name of a small tree the leaf of which is a Hmar favourite curry item (eurya acuminate)
Sizo changal hmepok (n),"porridge of rice-soda-sizo (plus meat or vegetables), a common and popular Hmar curry"
Sizucho (n),the Orion
Skolarship (n),scholarship
Skuash (n),"squash, a variety of vegetable"
Skul (n),school
So (n),the pulse
So (v),"boil, to bubble up, to effervesce, etc"
So (v),a leisure talk
Sohle (n),name of wild plant the leaf of which is edible
Soi (v),to chew or masticate (by the teeth)
Soi chip (v),to chew up
Soi nawi (v),"to chew up, to masticate thoroughly, to chew thoroughly"
Soisa (v),"to play with, to have fun with"
Soisel (v),"to raise objections, to find fault with, to make excuse, to speak against"
Soisel bo (adj),"without fault, faultless, blameless"
Soisel bovin (adv),"blamelessly, perfectly, without fault"
Soisel hmang (n),"one given to raising objections, finding fault, etc"
Soiselna (n),"criticism, objection, reproach"
Sokhlei (n),name of a flower
Sokkhe (n),gecko
Sokvom (n),a variety of snake
Solfa (n),solfa
Som (v),"taking along, coming along with"
Som (n),dowry
Somdawl (v),"to aid, to assist as in work, food, etc"
Somdawlna (n),"relief, assistance"
Son (v),"move, shift, to move from one place to another"
Song (adv),"completely (time), to be on forever, permanently"
Songate (n),a Hmar Lungtau sub clan
Songka (n),the platform in front of a Hmar traditional house
Songsongbokbok (n),name of nosy insect
Sonhmang (v),"to remove, move away"
Sontlung (n),a variety of soil
Sop (adj),"unclean, untidy"
Sop (v),"to beat, to hit (extreme)"
Sor (v),"to engage (in manual work), to employ, to use someone’s service"
Sorkar (n),a Hindi originated term for government
Sorthlapui (n),poetical word for moon
Sosang (v),to flare up
Spawts (n),sports
Stethoscope (n),stethoscope
Su (v),to move or sway up and down
Su (n),the vulva
Suhmul (n),the female pubic hair
Sui (v),"to investigate, to track, to trace; to kick; to tie in a weaver's knot, to tie"
Suibawk (v),"to tie a knot in a single piece of string, etc"
Suilungleng (v),poetical term to meant one is longing for one’s lover
Suipingpilip (n),one form of tying by a string
Suisuok (v),"to trace out, to investigate and find the logical conclusion"
Suisuok ruol lo (adj),"unsearchable, inscrutable, unfathomable"
Suisuokna (n),"investigation, research"
Suitak (n),a reef knot
Suitungturut (n),"to tie in an ordinary knot, an ordinary knot"
Sukbahla (v),to hinder from doing a thing
Sukbeidong (v),"to give grief and bitterness, distress, trouble, misery, etc"
Sukbit (v),to fill
Sukbohmang (v),"to destroy, wipe off, to sweep away"
Sukbong (v),to break off
Sukboral (v),"to ruin, to lose"
Sukbum (v),to gather
Sukbuo (v),"to spill, to upset"
Sukbuoi (v),"to disturb, to set in an uproar"
Sukbuongbar (v),"to distort truth, to pervert justice, to lead astray"
Sukchai (v),"to slow down, to hinder"
Sukchau (v),to weaken
Sukchawl (v),"to stop, to give a break"
Sukchep (v),to make the space between more cramped
Sukchiai (v),"to confuse, to bewilder"
Sukchim (v),"to bring down, to pull down"
Sukchimit (v),"to exterminate, to extinguish"
Sukchin (v),to make it small
Sukchingpen (v),"to disorder, to muddle up, to put out of proper order"
Sukchip (v),"to close (the gap), to minimize (the space between two objects)"
Sukchok (v),"to light up (fire), to put on (a lamp)"
Sukdam (v),"to heal, to save"
Sukdamna (n),a cure
Sukdamtu (n),"healer, one who cures"
Sukdanglam (v),"to alter, to vary, to make different"
Sukdar (v),"to scatter, to disperse"
Sukdawng (n),"to deprive, to deceive"
Sukden (v),"to make it tight, to ram"
Sukdik (v),"to correct, to rectify"
Sukduda (v),"to ill-treat, to maltreat"
Sukfai (v),"to clean, to clear"
Sukfamkim (v),"to make perfect, to give fullness"
Sukfel (v),"to settle, to decide"
Sukhadam (v),"to refresh, to make one feel refreshed"
Sukhar (v),"to wake up, to cheer up, to enlighten"
Sukhausa (v),"to make rich, to enrich"
Sukhautak (v),to make it difficult
Sukhek (v),"to use up, to consume, to waste, to eat a lot of"
Sukhel (v),to cause to revolt
Sukhelhol (v),to make restless
Sukhlawk (v),to give profit
Sukhliem (v),to wound
Sukhlim (v),"to please, to make happy"
Sukhlum (v),"to kill, to extinguish"
Sukhmang (v),to lose
Sukhmasawn (v),to develop
Sukhmin (v),"to cook, to ripen, to bring into subjection"
Sukhmingsie (v),to defame (name)
Sukhmingsietna (n),defamation
Sukhnawng (v),to make it wet
Sukhnufuol (v),to hinder progress
Sukhnuoi (v),to lower
Sukhrat (v),"to make strong, strengthen"
Sukhrilhai (v),"to confound, to put to shame"
Sukhring (v),"to keep or make alive, to save, to bring to life"
Sukhuoi (v),to embolden
Sukinhning (v),"to shake, to shatter"
Sukinhoi (v),make it pleasant
Sukintui (v),to melt
Sukkang (v),to raise up
Sukkawi (v),to bend
Sukkhat (v),to fill
Sukkhawhlo (v),"to spoil, to pervert"
Sukkhawtlai (v),to waste time
Sukkhok (v),"to graze, to scrape up skin or bark"
Sukkiem (v),"to lessen, to reduce"
Sukkin (v),"to bring to a close, to finish"
Sukkoi (v),to break
Suklang (v),"to expose, to show"
Suklawm (v),"to please, to amuse, to make one happy"
Suklet (v),"to turn round, to turn over or upside down"
Suklien (v),to magnify
Suklum (v),"to heat, to warm"
Suklungawi (v),"to please, to satisfy"
Suklungnilo (v),"to displease, to offend"
Suklungsen (v),"to anger, to make one angry, to provoke, to offend"
Suklungzing (v),"to worry, to disturb, to perplex"
Sukmang (v),to exterminate
Sukmangang (v),"to amaze, to worry, to put in a fix"
Sukmit (v),to extinguish
Sukmuk (v),to press closely together
Sukmuolpho (v),to put to shame
Sukna (v),to hurt (v) crusher
Suknawi (v),"to pulverize, to make into small pieces"
Suknawmna (v),to oppress
Suknawmnatna (n),oppression
Suknghet (v),"to make firm or rigid or prosperous or stable, etc"
Suknui (v),to make someone smile or laugh
Sukpar (v),"to spread out (as cloth, hands, tail, etc)"
Sukpawi (v),to make someone defamed
Sukpelsol (v),to dislocate
Sukphit (v),to make into fine powder
Sukpoi (v),"to mar, to spoil"
Sukpol (v),to mix
Sukporche (v),to make dirty
Sukram (v),to completely destroy
Sukre (v),"to stop, to quiet"
Sukrimsi (v),"to make somebody’s life miserable, to mistreat"
Sukrinum (v),"to make one uncomfortable, to offend, to punish"
Sukriral (v),to finish off
Sukropui (v),to glorify
Sukrui (v),to intoxicate
Suksawl (v),"to fatigue, to drain out someone"
Suksei (v),"to extend, to make it longer"
Suksie (v),to destroy
Suksil (v),"to maim, to injure, to wound, to disable"
Suksuok (v),"to bring out, to put out"
Suksuoktu (n),"one who brings out or puts out, a founder, an originator, a composer, an institutor"
Suksuol (v),make a mistake
Suktawp (v),to stop
Sukte (n),name of a tribe
Sukthieng (v),"to clear, clean, to clean, etc"
Sukthienghlim (v),to purify
Sukthitling (v),to bruise
Sukthla (v),to drop unintentionally
Sukthler (v),"to split, to rip up"
Sukthliek (v),to break
Sukthlong (v),"to give away, to part with one’s belongings or property because of extreme reason"
Sukthlu (v),"to knock over, to push over, to knock down"
Suktlai (v),"to treat, to stand treat"
Suktliek (n),"to snap, to break"
Suktluk (v),"to settle, to resolve"
Suktlun (v),to straighten
Sukul (v),to scorch slightly
Sukuong (v),to give pride
Sukup (v),to shelter from the wind
Sukut (v),"to scorch much, to burn"
Sukvangnei (v),"to make one lucky, to give luck"
Sukvar (v),"to light up, to lighten"
Sukvum (v),"to pile up (as when measuring grain, etc)"
Sukzak (v),to put to shame
Sukzalen (v),to set free
Sukzam (v),"to frighten, to make afraid"
Sukzau (v),to enlarge
Sul (n),the womb
Sûl (n),name of small plant
Sûl ang zui (phrase),"those who have gone ahead to (jhum field, etc) lay the leaf of ‘sul’ as a signed to those who are coming after that he has gone ahead; those who come afters follow the ‘sul’ and so it is"
Sul hna (n),the leaf of ‘sul’ planted on jhum path as a signal and on village entrance on the day of ‘khawser’ to signal one that he is forbidden to enter the village on that day
Sul inle (v),a couple’s first visit of the wife’s family
Sul khat suok (n),children of the same mother and father
Sulhnung (n),"a trace, a mark, a sign (of human), the work which one leaves behind"
Sulpel (v),"to overlap, to pass by, to pass"
Sulsutu (n),"the leader, pioneer"
Sum (n),"money, wealth"
Sum (n),a large mortar for pounding paddy
Sûm (n),"cloud, mist"
Sùm (n),see ‘fùn’
Sum enkoltu (n),"a cashier, treasurer"
Sum hmun (n),the front porch of a Hmar house where a mortar is usually placed
Sum hnar (n),a source of income
Sum insuo (v),refund of bride price paid to a woman by her husband’s family as confirmation of separation or divorce initiated by the woman
Sum khum sa (n),the four-legged animal killed by a girl’s family when all formalities of paying bride price are completed by the boy’s family (lengthwise half of the animal excluding the head and the internal parts but including the tail will be given to the boy’s family and is known as ‘sahrap’. The girl’s family will cook their share of the ‘sum khum sa’ and invite the ‘makpa bul’ and ‘laibung bul’ of the boy’s family and their own ‘makpa bul’ and ‘laibung bul’ to partake a meal that will consist of different parts of the meat including the internal parts and is known as ‘sabar’)
Sum le pai (n),money and belongings
Sumdawng (v),"to trade, to do business, to buy and sell"
Sumdawngna (n),a trade
Sumdawngna hmun (n),trade centre
Sumdengzu (n),the rice beer being offered by ‘anchongpa’ to the young maidens who help him in husking rice and other things for his ‘sesun inchong’
Sumlaitan (v),to divide the bride price when arranging a separation by mutual consent
Sumleivak (n),"a ground fog, fog that travels along the ground"
Sumphuk (n),the veranda of a Hmar traditional house
Sumrisang (n),the rainbow
Sumtuol (n),poetical term for the front side of the house
Sun (v),"to stab, to spear, to prick, to pierce"
Sùn (n),day time
Sùn (v),"to take after, to resemble (parents, etc)"
Sûn (v),to mourn
Sun changzawl (n),midday time
Sun le zan (n),day and night
Sun pel (n),to pass through a village without putting up for the night
Sun var (v),"to throw light, daylight"
Sun zan zomin (adv),"day and night running, continuously"
Sunagog (n),synagogue
Sunah (adv),in the day
Sunate (n),a Hmar Lungtau sub clan
Sung (v),pour down from one container to another
Sung (v),"to cast (aluminium utensils, etc)"
Sûng (adj),"duration, period of time"
Sûng (n),"family, household"
Sûng (n),"the inside (of anything), within"
Sung khat (n),"kinsman, cousins"
Sung kim (n),"a whole family, a family of none missing due to being away or death"
Sung po (adj),during the whole time
Sung sungin (adv),"family wise, by families"
Sungah (adv),"in, into, inside, within"
Sungkhaw (n),"loose motion, watery diarrhoea, to have diarrhoea"
Sungkuo (n),family
Sungril (adj),inner most
Sungte (n),a sub clan of Hmar Lawitlang
Sungthlak (n),the length of the inside of a Hmar house exclusive of the front porch
Sunhang (n),dot
Sunhlu (n),the gooseberry
Sunhlu kunga thei dang a ra ngai nawh (phrase),the gooseberry tree produces gooseberry fruit which literally means like father like son
Sunhlum (adv),to kill by piercing with pointed weapon
Sunna (n),"obituary, condolence"
Sunni intawi (adv),to shorten the day
Sunnithlak (adj),whole day
Sunpui (v),to grieve with
Sunpuina (n),condolence
Sunu (n),cooked lime eaten along with betel nut and leaf
Sunzom (v),continue
Sunzomna (n),"continuation, extension"
Suo (n),east
Suo (v),contribute
Suo (v),complete
Suo (v),"release, to free, to let out"
Suodur (n),a shovel
Suoi (adj),signature
Suok (n),slave
Suok (v),"go out, move out"
Suokling (n),a Hmar Khawlhring sub clan
Suokna (n),"exit, an outlet, the source"
Suoksan (v),"go out from, move away from"
Suoktau (v),"to go out in anger, to go out as sign of protest"
Suokvak (v),"to go into the jungle (to search food, hunt, etc)"
Suokvakna (v),"where one goes into the jungle (in search of food, hunting, fishing)"
Suol (adj),"at fault, sin, bad, wicked, sinful, faulty, wrong, by mistake, in error, wrongly"
Suol thupha chawi (v),"to apologise, to ask for forgiveness"
Suol thupha chawina (n),an apology
Suolhron (v),"rape committed by more than one person, a mass rape"
Suollui (v),"rape (of a woman by man), to commit adultery by force"
Suolna (n),"a sin, a fault, etc"
Suom (v),"to rob, to plunder"
Suomhmang (n),a robber
Suomte (n),a sub clan under Hmar Lawitlang Varte
Suon (v),to take off the fire (as a pot)
Suon (n),"a metal (bronze, lead)"
Suon (n),"an offspring, a generation"
Suondam (n),a piece of cloth used to avoid heat while cooking
Suong (v),"to be proud of, to be pleased with"
Suong (v),"to cook, to boil, to distil"
Suong so (v),to boil
Suongchâwm (n),name of a species of bird
Suonginsam (adj),to run out of rice or food for cooking
Suonglung (n),poetical term for rock
Suongsam (adj),to run out of rice or food for cooking
Suongtawloi (n),the one who is at the top of which one is proud of or pleased with
Suongtuo (v),"to imagine, to visualise, to picture oneself"
Suongtuona (n),"plan, schemes, thoughts"
Suongum (adj),"good, worthy, commendable"
Suongvawr (n),"the pride of prides, on which one pleased the most"
Suonkang (n),"a frying pan, the name of an iron pan used to fry curry"
Suonkuol (n),a ring of cane to put under a pot to keep it from rolling
Suonlam (v),"an excuse, to make an excuse"
Suonlam nei (v),to have an excuse
Suonlam siem (v),to make an excuse
Suonmong (n),one who die without progeny
Suonmong rorel (adj),to make judgement randomly in extravagant manner without any thought of cost-cutting measure and parsimony
Suontriek (n),a piece of cloth used to avoid heat while cooking
Suopui (n),"relative by blood or lineage, kith and kin"
Suor (n),the name of a shelf in a Hmar traditional house opposite to the hearth usually on the lower side of the hill slope
Suor (n),a rapid (of river)
Suorsietna hmun (n),a place where the rapid is tough and difficult to navigate through
Suorthlak (n),"a platform on which rice is trodden out in jhum field, a threshing floor"
Suosal (v),"to accuse, to point finger at"
Suosal (v),"to question, to cross-examine, to ask for an explanation of conduct"
Suosam (v),"to ransack, to pillage, to plunder"
Suot (v),"to thin out (as plants), to kill off, to decimate"
Suot (v),to burrow
Sup sup (adv),together in a large scale (action taken)
Supari (n),a Hindi originated term for betel nut
Sur (v),"to rain, raining"
Sura (n),the legendary witty Hmar folk character
Sura favang bu thlir (n),to look things without going through in details as Sura looks his jhum paddy from the upper side and seems to be all fine
Sura lieng thlak ang (phrase),to change one’s direction before reaching one’s destination as Sura while carrying a load on his shoulder change it from right to left shoulder and then foolishly change his direction too
Sura tienami hril (phrase),to endlessly tell a story or give example when trying to explain something or tell a story as Sura have many tells and story
Sura umpui mu hrieta hriet (phrase),to know and understand just one thing and ignoring all other related issues
Surathosilen (n),a variety of non-edible mushroom with unbearable pungent smell
Suraumpui (n),the name of a wild creeper and its fruit
Suravokchal (n),the name of a fat cricket with short body and long hopper
Surei (n),a file
Sut (v),"to pound, to tap, to type, to print"
Sût (v),"unwrap, untie, rescind, reversed"
Sût (v),"to calculate, to estimate"
Suthlam (n),the charkha
Sutlaran (v),"to squander, to dissipate, to waste"
Sutlawk (n),to estimate before hand
Sutpui (n),a main pillar inside a house supporting the ridge pole
Ta (v),"stitch up, to plait (using split bamboo or cane)"
Ta (prn),mine (denoting ownership or possession); (ka ta = mine; I ta = yours)
Ta bawl (v),to treat a thing as one’s own
Ta chei (v),same as ‘ta bawl’
Ta ding (prepn),for (ka ta ding = for me)
Ta hnung (v),have already
Ta la (-),a singular verbal ending (hung ta la – come/single)
Ta nawh (v),"no more, no longer"
Ta unla (-),a plural verbal ending (hung ta unla – come/plural)
Tabernekul (n),tabernacle
Tah (adv),denoting past tense or the action being completed (ka fak ‘tah’ = I’ve eaten; ka hmu ‘tah’ = I’ve seen)
Tai (n),"the lower extremity of the bowels, the rectum"
Tai (v),"to be at enmity with, to hate"
Tai (adj),"rosy, ruddy (as cheeks)"
Taibawr (n),the lower bowels or rectum area
Taife (n),the left out or discarded rice from which beer is brewed
Taih (v),to push or butt or gore with the horn or tusk
Taihai (v),"to be at loss on what to do, bewildered"
Taikuong (n),a butt for holding pigs' foods made of a hollowed-out of tree trunk
Taikuong inkhup thrakin (phrase),to spent all what one has even to the point of selling off one’s pig – a domesticated animal almost every household have in traditional Hmar village family
Taima (adj),"diligent, industrious, energetic"
Taima takin (adv),"diligently, laboriously"
Taimak (adj),same as ‘taima’
Taimakna (n),"diligence, industriousness"
Tainem (n),the soft region of the lower part of the abdomen
Taitaw (n),name of wild fruit
Taithler (v),to tear or rip up with the horn or tusk
Taitil (n),title
Taiting (n),cane
Taivon (v),"to wear in the belt (as a dagger), to keep in the belt (as money)"
Tak (n),"appreciable in size or quality (for plants such as potatoes, yam, etc)"
Tak (adj),"true, real, actual, genuine"
Tak (adv),"very, really, exactly, the most; a superlative term (eg- a lien tak = biggest)"
Tak meuh (adv),really exactly
Tak tak (adv),"really, exactly, true, genuinely"
Takam (n),the term used to refer to the Chakma tribe
Takbo (adj),"nothing, no substance"
Takduoiin (adv),"perhaps, by chance"
Takin (adv),like ‘ly’ in English (inrang takin = quickly; muong takin = slowly)
Takluo ah (phrase),by the way
Taksa (n),"muscle, flesh, the body"
Taksa chau (n),fatigue
Takzet (adv),"truly, really, very much"
Tâl (v),"to struggle, to move, to wriggle"
Tala (n),a Hindi originated term for lock
Talen (n),talent
Taluo (adv),"very much, too much; indeed"
Tam (adj),"much, many, common, plentiful"
Tâm (n),scarcity of a particular plant due to disease or some destruction and obliteration
Tamhrang (n),a Hmar Lungtrau sub clan
Tamlo (n),a Hmar Biete sub clan; a Hmar Thriek sub clan
Tâmsel (adj),those that can withstand certain difficult and harsh situations
Tamtak (adv),"much, very much, too much"
Tan (v),"to chop or cut off, to cross (as a river)"
Tan bong (v),"to cut off, to chop off"
Tanbubel (n),a typical hairstyle of straight lower portion
Tang (v),to look upwards
Tang (v),to be imprisoned
Tang in (n),"jail, prison"
Tang vengtu (n),"a jail warden, jailor"
Tangka (n),"money, a rupee, silver"
Tangka ip (n),"a money bag, a purse"
Tangka sum (n),"money, riches"
Tangka sum enkoltu (n),"treasurer, cashier, accountant"
Tangkapui (n),a medal
Tangkaruo (n),"silver, white metal"
Tangkawng (n),the great lizard
Tangkawng vailak lam (n),a Hmar traditional dance (the song associated with it is called ‘tangkawng vailak hla’)
Tangkeu (n),name of a variety of lizard
Tangkhang (adj),stranded with no other means to move ahead
Tangkhip (n),lockdown
Tangmam (n),a species of lizard
Tangper (n),a particular variety of rice that is usually heated and husked and eaten
Tanhna (n),a particular item in a Hmar woman hand woven loom
Tap (n),"an elevated fireplace, a hearth"
Taphot (prn),"all, whoever"
Tapphel (n),the wooden framework of a Hmar hearth
Tapsai (n),the mound of earth at the back of a Hmar fireplace to protect the wall from fire
Taptebul titi (n),"a discussion of irrelevance, expression of wishful thinking"
Taptom (v),"to be a home bird, to be able to sit only by the fireplace (old or infirm person)"
Taptom ngaidan (n),opinion of home bird
Tar (n),"old (in age), to become old"
Tar (adj),tight
Tàr (v),"to stick on a pole, to make or set up a landmark, to hang, to paste on a wall"
Tar inhai (adj),"a childish character that comes with age, to be in one's old age"
Tar kuna dam (adj),to live to old age
Tar tieng pan (v),to approach old age
Tarang (n),lattice work made by split bamboos plaited together
Tardok (v),to hang up and expose to view
Target (n),target
Tarik (n),"date, the day of the months"
Tarlang (v),"to expose for view, to show up"
Tarmansa (n),a variety of non-edible wild mushroom with unbearable pungent smell
Tarmit (n),"spectacle, eyeglasses"
Tarpawlin (n),tarpaulin
Tarpi (n),one wife’s mother
Tarpilu (n),the name of a white ant’s nest used for burning in order to keep away insects
Tarpintel (n),turpentine
Tarpu (n),a wife's father or brother
Tàt (v),"to rub, to besmear"
Tât (n),a species of wild tree
Tât fai (v),"to rub clean, to rub (as the feet on a mat or scraper)"
Tât ngei (v),to sharpen (like knife)
Tatebem (n),a little girl’s handloom
Tâtna (n),anything used for sharpening knives or sharp objects
Tâtpawng (n),a species of wild tree
Tatte (n),the name of a tree
Tatu (n),a new term of ‘neitu’ (owner)
Tau (v),"to sulk, to be cross, displeased, angry"
Tauh (v),"to butt (as goat), to knock with the head, to knock the head against"
Tavuolpuon (n),a particular Hmar woman shawl
Tawek (n),name of a species of large ant
Tawi (adj),"short, to be short"
Tawite in (adv),"briefly, shortly, in short"
Tawk (v),to touch
Tawkdar (n),"bait, to put a bait, to bait"
Tawktawngang (n),a variety of caterpillar
Tawl (n),the rectum
Tawl (v),move (an item from one place to another)
Tawl tla (n),"a pile disorder, to have piles, piles"
Tawlailir (n),"wheels, a wheel a cart, a carriage"
Tawlkuo (n),the rectum
Tawllawt (n),name of birth
Tawllopuon (n),the name of a young woman's cloth
Tawlparit (n),slide (where) children play
Tawm (v),"to shrink, to crouch, to be crumpled, to be contracted, (as the finger, arm or leg)"
Tawm (adv),"near, nearing to, almost"
Tawm trep (adv),"just about to, on the verge of"
Tawmkal (n),a hand weaving material
Tawn (v),to wear (on the hair or head)
Tawn (adv),"one another, each other"
Tawnah (prn),poetical term for ‘in me’ or ‘near me’
Tawng (v),"to meet, to come face to face; to reach up to (in height)"
Tawng (n),a measurement from the elbow to the tip of the middle finger
Tawng (v),"to attack, to fight, to assault (from a distance)"
